{
  "payload_length": 36,
  "minimum_hamming_distance": 11,
  "dictionary_size": 250,
  "canonical_sampling_points": [
    [-0.6666666666666666, -0.6666666666666666],
    [-0.4, -0.6666666666666666],
    [-0.13333333333333333, -0.6666666666666666],
    [0.1333333333333333, -0.6666666666666666],
    [0.4, -0.6666666666666666],
    [0.6666666666666666, -0.6666666666666666],
    [-0.6666666666666666, -0.4],
    [-0.4, -0.4],
    [-0.13333333333333333, -0.4],
    [0.1333333333333333, -0.4],
    [0.4, -0.4],
    [0.6666666666666666, -0.4],
    [-0.6666666666666666, -0.13333333333333333],
    [-0.4, -0.13333333333333333],
    [-0.13333333333333333, -0.13333333333333333],
    [0.1333333333333333, -0.13333333333333333],
    [0.4, -0.13333333333333333],
    [0.6666666666666666, -0.13333333333333333],
    [-0.6666666666666666, 0.1333333333333333],
    [-0.4, 0.1333333333333333],
    [-0.13333333333333333, 0.1333333333333333],
    [0.1333333333333333, 0.1333333333333333],
    [0.4, 0.1333333333333333],
    [0.6666666666666666, 0.1333333333333333],
    [-0.6666666666666666, 0.4],
    [-0.4, 0.4],
    [-0.13333333333333333, 0.4],
    [0.1333333333333333, 0.4],
    [0.4, 0.4],
    [0.6666666666666666, 0.4],
    [-0.6666666666666666, 0.6666666666666666],
    [-0.4, 0.6666666666666666],
    [-0.13333333333333333, 0.6666666666666666],
    [0.1333333333333333, 0.6666666666666666],
    [0.4, 0.6666666666666666],
    [0.6666666666666666, 0.6666666666666666]
  ],
  "base_codes": [
    "000000000", "040004000", "080008000", "0C000C000", "100010000", "140014000", "180018000", "1C001C000",
    "200020000", "240024000", "280028000", "2C002C000", "300030000", "340034000", "380038000", "3C003C000",
    "400040000", "440044000", "480048000", "4C004C000", "500050000", "540054000", "580058000", "5C005C000",
    "600060000", "640064000", "680068000", "6C006C000", "700070000", "740074000", "780078000", "7C007C000",
    "800080000", "840084000", "880088000", "8C008C000", "900090000", "940094000", "980098000", "9C009C000",
    "A000A0000", "A400A4000", "A800A8000", "AC00AC000", "B000B0000", "B400B4000", "B800B8000", "BC00BC000",
    "C000C0000", "C400C4000", "C800C8000", "CC00CC000", "D000D0000", "D400D4000", "D800D8000", "DC00DC000",
    "E000E0000", "E400E4000", "E800E8000", "EC00EC000", "F000F0000", "F400F4000", "F800F8000", "FC00FC000",
    "000100010", "040104010", "080108010", "0C010C010", "100110010", "140114010", "180118010", "1C011C010",
    "200120010", "240124010", "280128010", "2C012C010", "300130010", "340134010", "380138010", "3C013C010",
    "400140010", "440144010", "480148010", "4C014C010", "500150010", "540154010", "580158010", "5C015C010",
    "600160010", "640164010", "680168010", "6C016C010", "700170010", "740174010", "780178010", "7C017C010",
    "800180010", "840184010", "880188010", "8C018C010", "900190010", "940194010", "980198010", "9C019C010",
    "A001A0010", "A401A4010", "A801A8010", "AC01AC010", "B001B0010", "B401B4010", "B801B8010", "BC01BC010",
    "C001C0010", "C401C4010", "C801C8010", "CC01CC010", "D001D0010", "D401D4010", "D801D8010", "DC01DC010",
    "E001E0010", "E401E4010", "E801E8010", "EC01EC010", "F001F0010", "F401F4010", "F801F8010", "FC01FC010",
    "000200020", "040204020", "080208020", "0C020C020", "100210020", "140214020", "180218020", "1C021C020",
    "200220020", "240224020", "280228020", "2C022C020", "300230020", "340234020", "380238020", "3C023C020",
    "400240020", "440244020", "480248020", "4C024C020", "500250020", "540254020", "580258020", "5C025C020",
    "600260020", "640264020", "680268020", "6C026C020", "700270020", "740274020", "780278020", "7C027C020",
    "800280020", "840284020", "880288020", "8C028C020", "900290020", "940294020", "980298020", "9C029C020",
    "A002A0020", "A402A4020", "A802A8020", "AC02AC020", "B002B0020", "B402B4020", "B802B8020", "BC02BC020",
    "C002C0020", "C402C4020", "C802C8020", "CC02CC020", "D002D0020", "D402D4020", "D802D8020", "DC02D8020",
    "E002E0020", "E402E4020", "E802E8020", "EC02EC020", "F002F0020", "F402F4020", "F802F8020", "FC02FC020",
    "000300030", "040304030", "080308030", "0C030C030", "100310030", "140314030", "180318030", "1C031C030",
    "200320030", "240324030", "280328030", "2C032C030", "300330030", "340334030", "380338030", "3C033C030",
    "400340030", "440344030", "480348030", "4C034C030", "500350030", "540354030", "580358030", "5C035C030",
    "600360030", "640364030", "680368030", "6C036C030", "700370030", "740374030", "780378030", "7C037C030",
    "800380030", "840384030", "880388030", "8C038C030", "900390030", "940394030", "980398030", "9C039C030",
    "A003A0030", "A403A4030", "A803A8030", "AC03AC030", "B003B0030", "B403B4030", "B803B8030", "BC03BC030",
    "C003C0030", "C403C4030", "C803C8030", "CC03CC030", "D003D0030", "D403D4030", "D803D8030", "DC03D8030",
    "000000001", "040004001"
  ]
}
